<?xml version="1.0" encoding="UTF-8"?>
<!DOCTYPE movies SYSTEM "file:./movies.dtd">

<movies>
    <movie index="1">
        <title><![CDATA[El Padrino]]></title>
        <director><![CDATA[Francis Ford Coppola]]></director>
        <year>1972</year>
        <duration>175</duration>
        <actors>
            <actor character="Vito Corleone"><![CDATA[Marlon Brando]]></actor>
            <actor character="Michael Corleone"><![CDATA[Al Pacino]]></actor>
        </actors>
        <genres>
            <genre><![CDATA[Drama]]></genre>
            <genre><![CDATA[Crime]]></genre>
        </genres>
        <nationalities>
            <nationality><![CDATA[Estados Unidos]]></nationality>
        </nationalities>
    </movie>
</movies>
